id	title	description	category	weight	defaultQuantity	stackSize	isContainer	isStorable	isEquippable	isConsumable	inventoryWidth	inventoryHeight	image	actionIds
item_armor_void_walker_incorporeal_robe	Incorporeal Robe	A robe of void-woven material. Light armor. While Incorporeal State is active, armor provides full protection without impeding phase movement.	armor		1	1	false	true	true	false	2	2		
item_armor_shell_dancer_reactive_vest	Reactive Vest	A vest that converts impact force into cascade energy. Light armor. Taking damage while wearing generates 1 extra Cascade beyond the standard trigger.	armor		1	1	false	true	true	false	2	2		
item_armor_curse_eater_absorption_coat	Absorption Coat	A coat constructed from purged curse material. Light armor. Bearer's maximum Loaded Count increased by 3. Corruption Points accumulate 50% slower.	armor		1	1	false	true	true	false	2	2		
item_armor_merchant_knife_cover_outfit	Cover Outfit	Civilian-grade clothing with concealed armor weave. Light armor. Passes as ordinary civilian attire. Grants advantage on social deception checks.	armor		1	1	false	true	true	false	2	2		
item_armor_iron_herald_command_plate	Command Plate	Heavy plate bearing Command Zone insignia. Heavy armor. While Command Zone is active, bearer is immune to Taunt and Silence.	armor		1	1	false	true	true	false	2	3		
item_armor_ashfoot_salvage_armor	Ashfoot Salvage Armor	Mismatched enhancement-component armor with irregular coverage. Medium armor. Bearer can repair it from Ashlands Salvage Components.	armor		1	1	false	true	true	false	2	3		
item_armor_chrome_shaper_config_suit	Configuration Suit	A suit of modular armor that adjusts with Chrome Shaper configuration switches. Medium armor. Provides different Guard bonuses per active configuration.	armor		1	1	false	true	true	false	2	3		
item_armor_blood_smith_vein_plate	Vein Plate	Armor with resonant-biological enhancement integration. Medium armor. When bearer pays HP costs, armor provides Guard 2 until end of next turn.	armor		1	1	false	true	true	false	2	3		
item_armor_wireweave_mesh_suit	Wireweave Mesh Suit	A full body wire-silk suit integrated with the Wireweave's network node. Light armor. Grants advantage on Wire Craft network interactions while worn.	armor		1	1	false	true	true	false	2	2		
item_armor_oni_hunter_hunter_coat	Hunter Coat	A long coat worn by Oni Hunters. Light armor. Provides advantage on tracking and pursuit actions. Reduces dissolution resonance contamination accumulation.	armor		1	1	false	true	true	false	2	3		
item_armor_hollow_void_robe	Void Robe	A robe that absorbs incoming resonance energy. Light armor. Empty Path: scales Guard with HP Percent inverse. Shell Path: provides flat Guard 4.	armor		1	1	false	true	true	false	2	2		
item_armor_ronin_masterless_coat	Masterless Coat	A long coat bearing no allegiance marks. Light armor. Provides advantage on all social checks in territory where bearer has no active allegiance.	armor		1	1	false	true	true	false	2	3		
item_augmentation_bone_lace	Bone Lace	Resonant filament woven through the skeletal structure. Grants +4 Max HP and immunity to the Stagger status effect.	augmentation		1	1	false	true	true	false	1	1		
item_augmentation_echo_array	Echo Array	Multi-node resonant antenna array distributed across the skull. Grants advantage on all Echomind-related checks and doubles Iron Afterlife perception range.	augmentation		1	1	false	true	true	false	1	1		
item_augmentation_wire_spine	Wire Spine	Full spinal wire-silk replacement. Grants +2 SIGNAL and enables simultaneous connection to two Wire Craft network nodes.	augmentation		1	1	false	true	true	false	1	2		
item_augmentation_resonant_heart	Resonant Heart	A resonant-biological hybrid cardiac replacement. Grants +6 Max HP and provides passive Regen 1 at start of each turn.	augmentation		1	1	false	true	true	false	1	1		
item_augmentation_void_lens	Void Lens	Single eye replacement with void-material optics. Grants vision into Between-space and reveals incorporeal entities within 30 feet.	augmentation		1	1	false	true	true	false	1	1		
item_augmentation_signal_cortex	Signal Cortex	Neural enhancement amplifying signal processing. Grants +2 SIGNAL. Wire Craft-dependent cards cost 1 less AP.	augmentation		1	1	false	true	true	false	1	1		
item_augmentation_iron_muscle	Iron Muscle Grafts	Full-body structural muscle reinforcement with resonant-iron weave. Grants +2 FRAME and advantage on all strength-based physical checks.	augmentation		1	1	false	true	true	false	2	2		
item_augmentation_dissolution_tracker	Dissolution Tracker	Subcutaneous sensor network detecting dissolution resonance. Grants advantage on detecting and tracking shell-state entities within 60 feet.	augmentation		1	1	false	true	true	false	1	1		
item_augmentation_grief_channel	Grief Channel	A resonant duct running from spine to hands. Allows Echo Speaker to physically channel grief-stacks into attacks, converting stacks directly to bonus damage.	augmentation		1	1	false	true	true	false	1	1		
item_augmentation_fracture_node	Fracture Node	A resonant node in the sternum generating fracture energy. Generates 1 Phantom Charge at start of each turn automatically.	augmentation		1	1	false	true	true	false	1	1		
item_augmentation_cascade_skin	Cascade Skin	Subcutaneous reactive plating converting impact force to cascade energy. Generates 2 Cascade on taking damage above a threshold (3+).	augmentation		1	1	false	true	true	false	1	1		
item_augmentation_binding_hands	Binding Hands	Hand augmentation with integrated thread-dispensers for Puppet Binder binding procedures. Apply binds at half AP cost.	augmentation		1	1	false	true	true	false	1	1		
item_augmentation_debt_etching	Debt Etching	Skin etching of Debt notation marks. Voice of Debt Debt-applying cards affect one additional target per use at no extra cost.	augmentation		1	1	false	true	true	false	1	1		
item_augmentation_intelligence_nodes	Intelligence Nodes	Distributed sensor nodes providing multi-point environmental analysis. Shadow Daimyo and Merchant Knife: grants one free intelligence stack per encounter.	augmentation		1	1	false	true	true	false	1	1		
item_augmentation_command_emitter	Command Emitter	Throat-mounted resonant emitter projecting Command Zone frequency. Iron Herald: Command Zone radius increases by 10 feet and requires no card to establish.	augmentation		1	1	false	true	true	false	1	1		
item_augmentation_loaded_reservoir	Loaded Reservoir	Subcutaneous reservoir storing absorbed curse material. Curse Eater maximum Loaded Count increased by 5. Loaded Count never drops below 2.	augmentation		1	1	false	true	true	false	1	1		
item_augmentation_phase_socket	Phase Socket	Spinal socket tuned to Between-space frequency. Void Walker: Incorporeal State entry and exit costs 0 AP. Phantom Charges generate passively.	augmentation		1	1	false	true	true	false	1	1		
item_augmentation_bio_weave	Bio-Weave	Living biological material woven through the skin. Flesh Shaper: HP Tier thresholds shift upward by 10%. Regenerates bearer's HP by 1 each turn.	augmentation		1	1	false	true	true	false	1	1		
item_augmentation_hollow_core	Hollow Core	A resonant void at the body's center. The Hollow: HP Percent scaling cards deal +25% damage. Bearer can sense nearby void concentrations.	augmentation		1	1	false	true	true	false	1	1		
item_augmentation_resonant_arm	Resonant Arm (Full Replacement)	Full arm replacement with resonant-metal construction. Grants +2 IRON and enables weapon-integration for class-specific arm weapons.	augmentation		1	1	false	true	true	false	2	2		
item_augmentation_signal_eye	Signal Eye	Eye replacement with full signal-spectrum vision. Grants detection of all active Wire Craft connections within 40 feet and reads signal frequencies.	augmentation		1	1	false	true	true	false	1	1		
item_augmentation_heat_sink	Heat Sink Array	Distributed thermal management system across the back. Reduces Overheat stack accumulation by 1 per turn automatically.	augmentation		1	1	false	true	true	false	2	2		
item_augmentation_pain_suppressor	Pain Suppressor Node	Neurological enhancement blocking pain signal transmission. Grants immunity to Vulnerable status. Enhancement stress checks have advantage.	augmentation		1	1	false	true	true	false	1	1		
item_augmentation_target_designator	Target Designator	Optical targeting integration providing combat analysis. Mark status applied by bearer lasts 1 additional turn. Ranged attacks against Marked targets have advantage.	augmentation		1	1	false	true	true	false	1	1		
item_augmentation_wire_hands	Wire Hands	Hand replacement with integrated wire-silk dispensers. Wireweave: network interaction range extended to 60 feet. Can establish connections as free action once per turn.	augmentation		1	1	false	true	true	false	1	1		
item_augmentation_between_eye	Between Eye	An eye attuned to Between-space frequency. Bearer sees entities and objects existing partially in Between. Reveals hidden phase-walkers.	augmentation		1	1	false	true	true	false	1	1		
item_augmentation_bone_hollow	Bone Hollow	Resonant hollowing of the major bones. Grants +4 Max HP and enables bearer to absorb one point of incoming damage per turn automatically.	augmentation		1	1	false	true	true	false	1	1		
item_augmentation_signal_lungs	Signal Lungs	Resonant replacement lung tissue with signal-harmonic capability. Voice of Debt and Iron Herald: voice-based cards affect targets up to 60 feet.	augmentation		1	1	false	true	true	false	1	1		
item_tool_resonance_scanner	Resonance Scanner	Handheld device reading and categorizing resonant frequencies in a 40-foot radius. Identifies enhancement types, Claimant signatures, and Afterlife proximity.	tool		1	1	false	true	false	false	1	1		
item_tool_wire_diagnostic_kit	Wire Diagnostic Kit	Precision tools for diagnosing Wire Craft network faults and enhancement system failures. Grants advantage on all Wire Craft repair and analysis checks.	tool		1	1	false	true	false	false	1	1		
item_tool_enhancement_removal_kit	Enhancement Removal Kit	Surgical toolkit for safe enhancement removal procedures. Required for voluntary enhancement removal without injury.	tool		1	1	false	true	false	false	1	1		
item_tool_caste_verification_device	Caste Verification Device	Handheld device reading Ironhold caste registration marks. Grants advantage on identifying caste status and forged caste documentation.	tool		1	1	false	true	false	false	1	1		
item_tool_signal_frequency_analyzer	Signal Frequency Analyzer	Device measuring and recording signal frequency signatures. Identifies individual Wire Craft users and enhancement system types.	tool		1	1	false	true	false	false	1	1		
item_tool_forge_calibration_set	Forge Calibration Set	Precision tools for calibrating resonant-metal enhancement systems. Required for Tier 2 and above enhancement installation.	tool		1	1	false	true	false	false	1	1		
item_tool_echomind_reader_probe	Echomind Reader Probe	Sutensai-grade device for conducting controlled Echomind readings without augmentation. Requires Iron Sutra training to use safely.	tool		1	1	false	true	false	false	1	1		
item_tool_afterlife_contact_array	Afterlife Contact Array	Multi-node resonant array for establishing reliable Iron Afterlife communication. Echoed and Echo Speaker primary tool; stabilizes contact attempts.	tool		1	1	false	true	false	false	1	1		
item_tool_void_measurement_device	Void Measurement Device	Instrument measuring void energy density and Between-space proximity. Fracture Knight and Void Walker navigation utility.	tool		1	1	false	true	false	false	1	1		
item_tool_contamination_scrubber	Contamination Scrubber	Device removing Engine Scar contamination from equipment and biological material. Each use clears one contamination tier from target object.	tool		1	1	false	true	false	false	1	1		
item_tool_binding_thread_analyzer	Binding Thread Analyzer	Device reading and analyzing active binding thread connections. Puppet Binder utility; reveals all active binding relationships within 30 feet.	tool		1	1	false	true	false	false	1	1		
item_tool_debt_ledger	Debt Ledger	A formal accounting device tracking outstanding Debt obligations. Voice of Debt utility; provides mechanical advantage when detonating debt against recorded targets.	tool		1	1	false	true	false	false	1	1		
item_tool_intelligence_compiler	Intelligence Compiler	Device organizing and cross-referencing intelligence data. Shadow Daimyo and Merchant Knife utility; compiling intelligence on a target grants 1 bonus stack.	tool		1	1	false	true	false	false	1	1		
item_tool_cascade_meter	Cascade Meter	Resonant instrument measuring cascade energy levels in the environment. Shell Dancer utility; provides early warning of high-cascade events.	tool		1	1	false	true	false	false	1	1		
item_tool_fracture_energy_collector	Fracture Energy Collector	A device harvesting ambient fracture resonance. Fracture Knight utility; provides 1 Phantom Charge per long rest from ambient collection.	tool		1	1	false	true	false	false	1	1		
item_tool_grief_stone_resonator	Grief Stone Resonator	An amplification device for grief-resonance. Echo Speaker utility; doubles the range of grief-resonance effects during Iron Afterlife contact.	tool		1	1	false	true	false	false	1	1		
item_tool_wire_market_broker_kit	Wire Market Broker Kit	Tools and documentation for conducting Wire Market transactions. Merchant Knife utility; all trade-based social checks have advantage when kit is visible.	tool		1	1	false	true	false	false	1	1		
item_tool_iron_sutra_ritual_kit	Iron Sutra Ritual Kit	Complete tools for conducting Iron Sutra rituals. Sutensai class requirement for advanced ritual procedures.	tool		1	1	false	true	false	false	1	1		
item_tool_puppet_control_remote	Puppet Control Remote	A remote device for managing Puppet Binder vessel commands at range. Commands to bound vessels can be issued from up to 60 feet.	tool		1	1	false	true	false	false	1	1		
item_tool_blood_enhancement_monitor	Blood-Enhancement Monitor	Device monitoring Blood Smith biological-enhancement integration. Provides early warning before Enhancement Status shifts to Failing.	tool		1	1	false	true	false	false	1	1		
item_tool_flesh_shaper_bio_scanner	Bio Scanner	Device analyzing biological material quality for Flesh Shaper procedures. Identifies optimal Bio-Reinforcement Compound sources.	tool		1	1	false	true	false	false	1	1		
item_tool_hollow_path_detector	Path Detector	A resonant instrument measuring Empty versus Shell path resonance density. The Hollow utility; confirms path integrity and identifies resonance contamination.	tool		1	1	false	true	false	false	1	1		
item_tool_zone_marker_set	Command Zone Marker Set	A set of four resonant stakes used to physically mark Iron Herald Command Zone boundaries. Zone is harder to disrupt when physically marked.	tool		1	1	false	true	false	false	1	1		
item_consumable_resonant_charge_cell	Resonant Charge Cell	Disposable resonant energy cell providing a burst of signal energy. Grants one additional Resonant Card use per encounter. Single use.	consumable		1	99	false	true	false	true	1	1		
item_consumable_fracture_catalyst	Fracture Catalyst	A chemical catalyst triggering rapid fracture resonance generation. Grants 3 Phantom Charges immediately. Enhancement stress check required.	consumable		1	99	false	true	false	true	1	1		
item_consumable_grief_distillate	Grief Distillate	Highly concentrated grief-resonance in liquid form. Grants 3 grief stacks immediately for Echo Speaker. Causes Vulnerable 1 as a side effect.	consumable		1	99	false	true	false	true	1	1		
item_consumable_void_catalyst	Void Catalyst	A catalyst accelerating void resonance concentration. Grants 2 Anchor Points for Void Walker. Single use.	consumable		1	99	false	true	false	true	1	1		
item_consumable_cascade_primer	Cascade Primer	Applied to armor before combat. Grants 4 Cascade at encounter start for Shell Dancer. Single use.	consumable		1	99	false	true	false	true	1	1		
item_consumable_debt_ink	Debt Ink	Ritual ink used in Voice of Debt procedures. Applying to a target before combat places 1 pre-existing Debt stack. Single use.	consumable		1	99	false	true	false	true	1	1		
item_consumable_binding_resin	Binding Resin	Resin that hardens into binding-thread material. Puppet Binder emergency supply; provides binding thread for one procedure without requiring a spool.	consumable		1	99	false	true	false	true	1	1		
item_consumable_loaded_catalyst	Loaded Catalyst	Concentrated curse material. Adds 2 Loaded Count to Curse Eater immediately. Single use; slight corruption accumulation.	consumable		1	99	false	true	false	true	1	1		
item_consumable_bio_growth_compound	Bio-Growth Compound	Accelerated biological growth compound for Flesh Shaper. Restores bearer to the next HP Tier up regardless of current HP.	consumable		1	99	false	true	false	true	1	1		
item_consumable_hp_percent_elixir	HP Percent Elixir	Elixir that temporarily inflates HP Percent reading. The Hollow: all HP Percent-scaling cards use maximum (100%) value for one encounter.	consumable		1	99	false	true	false	true	1	1		
item_consumable_intelligence_compound	Intelligence Compound	Chemical compound enhancing information retention and pattern recognition. Shadow Daimyo and Merchant Knife: next intelligence-gathering action provides 2 stacks.	consumable		1	99	false	true	false	true	1	1		
item_consumable_signal_amplifier	Signal Amplifier Vial	Temporary signal frequency amplification compound. All signal-based cards deal +3 damage and apply +1 to status stacks for one encounter.	consumable		1	99	false	true	false	true	1	1		
item_consumable_resonant_food	Resonant Meal	A meal prepared with resonant-treated ingredients. Provides standard nutrition and grants Regen 2 for the first two turns of next encounter.	consumable		1	99	false	true	false	true	1	1		
item_consumable_between_stabilizer	Between Stabilizer	Compound stabilizing Between-space exposure effects. Prevents Between bleed-through for one full day. Required for extended phase-walk operations.	consumable		1	99	false	true	false	true	1	1		
item_consumable_afterlife_anchor_compound	Afterlife Anchor Compound	Prevents Echomind drift and Afterlife entity attachment for 48 hours. Required for extended Ashlands and Veilward operations by Echoed characters.	consumable		1	99	false	true	false	true	1	1		
item_consumable_pain_inhibitor	Pain Inhibitor	Short-term neurological compound blocking pain and Vulnerable status. Lasts one encounter. Enhancement stress check at encounter end.	consumable		1	99	false	true	false	true	1	1		
item_consumable_resonance_cleanse	Resonance Cleanse	Ritual compound clearing accumulated resonant contamination. Removes all active negative resonance effects and resets contamination status.	consumable		1	99	false	true	false	true	1	1		
item_consumable_field_surgery_kit	Field Surgery Kit	Emergency surgical supplies for field trauma treatment. Restores 8 HP and removes Bleed. Requires 1 minute outside combat to apply.	consumable		1	99	false	true	false	true	1	1		
item_consumable_armor_patch	Armor Patch	Quick-bonding resonant compound for in-combat armor repair. Restores Guard 3 immediately. Single use; takes free action to apply.	consumable		1	99	false	true	false	true	1	1		
item_consumable_enhancement_coolant	Enhancement Coolant	Thermal management compound reducing Overheat accumulation. Removes all current Overheat stacks immediately. Single use.	consumable		1	99	false	true	false	true	1	1		
item_consumable_resonant_ration_bar	Resonant Ration Bar	Compressed resonant-treated nutrition block for field operations. Provides sustenance and grants +1 HP at start of next encounter.	consumable		1	99	false	true	false	true	1	1		
item_consumable_void_void_null	Void Null	Compound suppressing void resonance activity. Prevents Fracture stacks and Phantom Charge generation for one encounter. Primarily for counter-use against enemies.	consumable		1	99	false	true	false	true	1	1		
item_consumable_wire_craft_jammer	Wire Craft Jammer	Compact device that jams all Wire Craft signals in a 20-foot radius for 3 turns. Affects all targets including allies.	consumable		1	99	false	true	false	true	1	1		
item_consumable_truth_serum	Truth Serum	A chemical compound inhibiting deceptive speech. Target cannot intentionally lie for 10 minutes. Used in interrogation and negotiation.	consumable		1	99	false	true	false	true	1	1		
item_consumable_memory_compound	Memory Compound	Compound enhancing Echomind memory recall. Allows access to any memory clearly experienced within the last month with perfect clarity.	consumable		1	99	false	true	false	true	1	1		
item_consumable_caste_masking_agent	Caste Masking Agent	Chemical compound masking enhancement signatures to appear as a different caste tier. Lasts 4 hours; defeats standard caste verification.	consumable		1	99	false	true	false	true	1	1		
item_consumable_resonant_explosive	Resonant Charge	Thrown explosive charge. Deals 6 + SIGNAL damage to all targets within 10 feet. Applies Stagger 1. Single use.	consumable		1	99	false	true	false	true	1	1		
item_consumable_signal_flare	Signal Flare	Resonant flare visible to both physical sight and Wire Craft scanning within 200 feet. Used for signaling, distraction, or area denial.	consumable		1	99	false	true	false	true	1	1		
item_consumable_field_resonance_kit	Field Resonance Kit	Compact kit for emergency resonant repair and calibration. Restores one enhancement to Stable status. Requires 5 minutes to apply.	consumable		1	99	false	true	false	true	1	1		
item_document_forged_registration_papers	Forged Registration Papers	Official documentation registering a Forged unit with Ironhold administration. Required for legal status in Ironhold territory.	document		1	1	false	true	false	false	1	1		
item_document_class_license	Class License	Official documentation certifying a character's class affiliation and legal standing. Required for certain high-security operations.	document		1	1	false	true	false	false	1	1		
item_document_sutensai_ordinance_writ	Sutensai Ordinance Writ	A formal writ issued by a Sutensai authorizing a specific action within Ironhold territory. Provides legal cover for one potentially illegal operation.	document		1	1	false	true	false	false	1	1		
item_document_wire_market_charter	Wire Market Charter	Documentation establishing a Wire Market business operation. Provides cover for Wire Craft operations and trade activities in the Pale Reach.	document		1	1	false	true	false	false	1	1		
item_document_korrath_military_dispatch	Korrath Military Dispatch	A sealed military communication bearing Korrath's seal. Either a genuine order or a forgery. Provides command authority over Ironhold soldiers.	document		1	1	false	true	false	false	1	1		
item_document_vaen_testimony	Vaen's Testimony	A recorded testimony from Vaen of the Empty Hand. Carries legal and spiritual weight in all territories. Can compel compliance from Vaen-aligned individuals.	document		1	1	false	true	false	false	1	1		
item_document_author_network_map	Author Network Map	Partial map of the Hollow Author's puppet network in one territory. Provides intelligence on Author-controlled locations and personnel.	document		1	1	false	true	false	false	1	1		
item_document_seven_convergence_prophecy	Seventh Convergence Prophecy	A fragment of prophetic text regarding the Seventh Convergence. Provides context for current campaign events. Value as historical artifact.	document		1	1	false	true	false	false	1	1		
item_document_echomind_research_notes	Echomind Research Notes	Academic notes on Echomind resonance patterns from before the Ascension War. Provides technical understanding of Echomind mechanics.	document		1	1	false	true	false	false	1	1		
item_document_ascension_war_record	Ascension War Record	A military history of the Ascension War period. Provides context for Claimant motivations and historical allegiances.	document		1	1	false	true	false	false	1	1		
item_document_enhancement_registry	Enhancement Registry	A registry of all legally installed enhancements for one individual. Required for certain Sutensai procedures and caste verification.	document		1	1	false	true	false	false	1	1		
item_document_iron_sutra_fragment	Iron Sutra Fragment	A fragment of Iron Sutra scripture. Provides spiritual authority in encounters with Iron Sutra adherents. Required for certain ritual procedures.	document		1	1	false	true	false	false	1	1		
item_document_wire_market_price_list	Wire Market Price List	Current pricing and availability for Wire Market goods and services. Provides advantage on all Wire Market transactions.	document		1	1	false	true	false	false	1	1		
item_document_dissolution_research	Dissolution Research	Academic research on dissolution resonance and shell-state mechanics. Oni Hunter utility; grants advantage on identifying dissolution-touched targets.	document		1	1	false	true	false	false	1	1		
item_document_claimant_network_chart	Claimant Network Chart	A hand-drawn chart mapping known relationships between all three Claimants and their supporters. High intelligence value.	document		1	1	false	true	false	false	1	1		
item_document_forged_technical_manual	Forged Technical Manual	Technical documentation for Forged chassis maintenance and modification. Grants advantage on all Forged-related maintenance checks.	document		1	1	false	true	false	false	1	1		
item_document_wanted_notice	Wanted Notice	A formal notice identifying a target. Carrying this about a target provides social leverage with law enforcement. Can be forged.	document		1	1	false	true	false	false	1	1		
item_document_safe_house_key	Safe House Key	A marked resonant key providing access to a faction-controlled safe house. Location varies by faction; provides shelter and basic supplies.	document		1	1	false	true	false	false	1	1		
item_document_patrol_schedule	Patrol Schedule	Intercepted or purchased patrol schedule for a specific installation. Grants advantage on stealth checks within that location for one session.	document		1	1	false	true	false	false	1	1		
