id	title	description	category	weight	defaultQuantity	stackSize	isContainer	isStorable	isEquippable	isConsumable	inventoryWidth	inventoryHeight	image	actionIds
item_material_unregistered_resonant_alloy	Unregistered Resonant Alloy	Refined resonant metal sufficient for one Resonant Grade enhancement procedure. No documentation trail; invisible to Sutensai Reading and Wire Market registration.	gear		1	1	false	true	false	false	1	1		
item_resonant_history_instrument	Resonant History Instrument	When placed against a resonant metal surface, reads accumulated impressions and broadcasts them at a level accessible to enhancement-bearing individuals nearby.	resonant		1	1	false	true	true	false	1	1		
item_consumable_cascade_rejection_suppressants	Cascade Rejection Suppressants	Grants +3 to FRAME-based resistance checks against enhancement failure for 24 hours and reduces rejection severity by one step.	consumable		1	99	false	true	false	true	1	1		
item_augmentation_presignal_receiver	Pre-Signal Receiver	Modification allowing bearer to receive messages through the Afterlife substrate up to six hours before they are sent, in areas of high temporal-resonance asymmetry.	augmentation		1	1	false	true	true	false	1	1		
item_augmentation_rejection_suppression_weave	Rejection Suppression Weave	Ashlands-derived enhancement modification extending operational life by two enhancement tier grades. Grants resistance to forced disabling effects.	augmentation		1	1	false	true	true	false	1	1		
item_gear_ronin_contract_token	Contract Token	A marked resonant disc representing an active Ronin contract. Identifies bearer as operating under a specific obligation; changes hands at contract completion.	gear		1	1	false	true	false	false	1	1		
item_gear_ashfoot_salvage_toolkit	Ashfoot Salvage Toolkit	Compact toolkit for disassembling and repurposing enhancement components in the field. Required for Enhancement Scavenge actions.	gear		1	1	false	true	false	false	1	1		
item_tool_veilblade_integration_kit	Wire Integration Kit	Tools for maintaining and calibrating Wire Craft-resonance hybrid systems. Veilblade class maintenance requirement.	tool		1	1	false	true	false	false	1	1		
item_tool_oni_hunter_dissolution_detector	Dissolution Detector	Handheld device measuring dissolution resonance levels. Oni Hunter utility; detects and tracks shell-state signatures.	tool		1	1	false	true	false	false	1	1		
item_gear_forge_tender_communal_repair_kit	Communal Repair Kit	Field repair tools oriented toward maintaining others' enhancements rather than the bearer's own. Forge Tender class item.	gear		1	1	false	true	false	false	1	1		
item_tool_wireweave_access_node	Network Access Node	Portable device establishing a personal Wire Craft network node. Wireweave class utility; enables network-interaction cards.	tool		1	1	false	true	false	false	1	1		
item_gear_chrome_shaper_config_plate	Configuration Plate	Modular component housing a single Chrome Shaper configuration's stat-modifier hardware. Swap plates between configurations in the field.	gear		1	1	false	true	false	false	1	1		
item_gear_pulse_caller_discharge_cell	Signal Discharge Cell	Replaceable power cell for Pulse Arm weapons. Provides three full-power discharge cycles before requiring replacement.	gear		1	99	false	true	false	false	1	1		
item_resonant_iron_monk_between_anchor	Between-Space Anchor	Dense resonant disc tuned to the boundary between the Between and the physical world. Stabilizes Between-state entry and reduces transition cost.	resonant		1	1	false	true	true	false	1	1		
item_resonant_afterlife_resonator	Afterlife Resonator	Resonant instrument amplifying Echo Speaker grief-stack accumulation rate. Doubles grief gained from ally deaths within range.	resonant		1	1	false	true	true	false	1	1		
item_resonant_phase_anchor	Phase Anchor	Crystallized void-material anchor for Void Walker phase operations. Stabilizes incorporeal-state duration and reduces anchor-point cost.	resonant		1	1	false	true	true	false	1	1		
item_gear_flesh_shaper_bio_compound	Bio-Reinforcement Compound	Biological material used in Flesh Shaper sculpting and crisis mend procedures. Required for advanced biological modification actions.	gear		1	99	false	true	false	false	1	1		
item_gear_puppet_binder_thread_spool	Binding Thread Spool	Coil of resonant wire used in Puppet Binder binding procedures. Each spool provides material for three binding applications.	gear		1	99	false	true	false	false	1	1		
item_consumable_enhancement_stabilizer_compound	Enhancement Stabilizer Compound	Injected compound stabilizing Blood Smith enhancement status from Stressed back to Stable. Single use.	consumable		1	99	false	true	false	true	1	1		
item_resonant_hollow_path_marker	Path Marker	A resonant marker attuned to the Empty or Shell path. The Hollow class focus item; amplifies path-specific card effects when held.	resonant		1	1	false	true	true	false	1	1		
item_document_shadow_daimyo_intelligence_file	Intelligence File	A compiled dossier on a specific target. Provides one free intelligence stack on the subject at encounter start.	document		1	1	false	true	false	false	1	1		
item_gear_voice_of_debt_debt_token	Debt Token	A physical marker representing an outstanding Debt obligation. Voice of Debt ritual object used in certain Debt-applying card rituals.	gear		1	99	false	true	false	false	1	1		
item_document_merchant_knife_trade_contract	Trade Contract Document	A formally bound trade obligation. Provides leverage equal to the contract value in social and coercive encounters.	document		1	1	false	true	false	false	1	1		
item_gear_iron_herald_command_beacon	Command Zone Beacon	A resonant marker placed to anchor an Iron Herald Command Zone. Required for establishing zones in unfamiliar territory.	gear		1	1	false	true	false	false	1	1		
item_consumable_curse_eater_absorption_vial	Absorption Vial	Allows Curse Eater to absorb one additional debuff beyond normal Loaded capacity for one encounter. Single use.	consumable		1	99	false	true	false	true	1	1		
item_resonant_shell_dancer_cascade_focus	Cascade Focus	Resonant disc amplifying Shell Dancer cascade generation. Each hit taken generates one additional cascade stack while equipped.	resonant		1	1	false	true	true	false	1	1		
item_resonant_fracture_crystal	Fracture Crystal	Crystal containing compressed fracture-resonance energy. Grants 2 Phantom Charges when broken. Single use.	resonant		1	99	false	true	false	false	1	1		
item_gear_unnamed_blank_card	Blank Condition Card	An unmarked resonant card awaiting definition. Used in The Unnamed card-naming rituals to formally define a new card condition through play.	gear		1	99	false	true	false	false	1	1		
item_doc_sunder_reach_ironhold_pass	Ironhold Military Pass	Ironhold-issued authorization permitting travel through controlled checkpoints in Sunder Reach. Expires after one campaign arc.	document		1	1	false	true	false	false	1	1		
item_doc_sunder_reach_territory_map	Sunder Reach Territory Map	Detailed military and civilian map of Sunder Reach including Cinderfort approaches, patrol routes, and Korrath stronghold boundaries.	document		1	1	false	true	false	false	1	1		
item_gear_sunder_reach_ration_pack	Ironhold Field Ration Pack	Standard-issue military field rations for extended Sunder Reach operations. Provides one long rest's sustenance in hostile territory.	gear		1	99	false	true	false	false	1	1		
item_doc_veilward_navigation_chart	Veilward Navigation Chart	Detailed chart of Veilward Reach resonant currents and safe transit corridors. Advantage on all navigation checks within the Reach.	document		1	1	false	true	false	false	1	1		
item_gear_veilward_resonant_water_flask	Resonant Water Flask	Flask of water from a high-resonance Veilward source. Drinking counts as one dose of minor Echomind stabilization. Holds three doses.	gear		1	1	false	true	false	false	1	1		
item_tool_pale_reach_wire_access_node	Pale Reach Wire Market Access Node	Registered access node for the Pale Reach Wire Market network. Provides legitimate cover for Wire Craft operations within the Reach.	tool		1	1	false	true	false	false	1	1		
item_doc_pale_reach_transit_papers	Pale Reach Transit Papers	Documentation establishing cover identity in Wire Market-controlled Pale Reach. Required for legal passage through high-security zones.	document		1	1	false	true	false	false	1	1		
item_tool_iron_teeth_maintenance_kit	Iron Teeth Industrial Maintenance Kit	Heavy-duty tools for maintaining industrial-scale enhancement and mining equipment. Advantage on repair checks within Iron Teeth Reach.	tool		1	1	false	true	false	false	1	1		
item_doc_iron_teeth_charter	Iron Teeth Charter Document	An official production charter granting extraction rights within a specific Iron Teeth mine sector. Provides legal cover and worker authority.	document		1	1	false	true	false	false	1	1		
item_armor_ashlands_contamination_suit	Engine Scar Contamination Suit	Full-body protective layer reducing Engine Scar contamination accumulation rate by half. Required for extended Ashlands operations.	armor		1	1	false	true	true	false	2	3		
item_gear_ashlands_survival_kit	Ashlands Survival Kit	Compiled survival tools for Ashlands operations: contamination readers, anti-toxin patches, emergency resonance flares.	gear		1	1	false	true	false	false	1	1		
item_gear_chars_brand_token	The Char's Brand Token	A burned resonant marker from the Ashlands collective. Grants safe passage through Char-controlled Ashlands territory.	gear		1	1	false	true	false	false	1	1		
item_gear_ironhold_standard_issue	Ironhold Standard Issue Kit	Basic equipment bundle issued to Ironhold military: field tools, identification, resonant flare, basic ration.	gear		1	1	false	true	false	false	2	2		
item_gear_sutensai_oracle_regalia	Sutensai Oracle Regalia	Formal vestments of a practicing Sutensai. Grants full social authority in Ironhold territory and access to Iron Sutra spaces.	gear		1	1	false	true	true	false	2	3		
item_doc_wire_market_standard_contract	Wire Market Standard Contract	A formally registered Wire Market trade contract. Provides legal protection for one transaction and identifies bearer as a registered participant.	document		1	1	false	true	false	false	1	1		
item_gear_korraths_campaign_token	Korrath's Campaign Token	A resonant marker distributed to Korrath's acknowledged allies. Grants recognition from Korrath-aligned forces. Dangerous in Author-held territory.	gear		1	1	false	true	false	false	1	1		
item_gear_vaens_covenant_seal	Vaen's Covenant Seal	A seal of acknowledgment from Vaen of the Empty Hand. Grants access to Vaen-aligned resources and safe passage through Vaen-held zones.	gear		1	1	false	true	false	false	1	1		
item_tool_iron_sutra_reading_focus	Iron Sutra Reading Focus	A calibrated resonant lens used by Sutensai to perform Echomind readings. Amplifies reading depth by one tier.	tool		1	1	false	true	false	false	1	1		
item_consumable_ap_stimulant	AP Recovery Stimulant	Restores 1 spent AP immediately. Cannot exceed AP Max. Single use.	consumable		1	99	false	true	false	true	1	1		
item_consumable_resonance_spike	Resonance Spike	Thrown disruption charge. Applies Overheat 3 and Silence 1 turn to target on hit.	consumable		1	99	false	true	false	true	1	1		
item_consumable_bleed_compound	Bleed Compound	Contact poison applied to blade or wound. Applies Bleed 3 for 3 turns to target.	consumable		1	99	false	true	false	true	1	1		
item_consumable_guard_resin	Guard Resin	Quick-hardening resonant compound applied to armor or skin. Applies Guard 4 lasting until end of next turn.	consumable		1	99	false	true	false	true	1	1		
item_consumable_overclock_serum	Overclock Serum	Enhancement performance booster. Grants +2 to one chosen stat for one encounter. Enhancement stress check required at encounter end.	consumable		1	99	false	true	false	true	1	1		
item_consumable_echomind_stabilizer	Echomind Stabilizer	Resonant compound suppressing Afterlife bleed-through and possession vulnerability. Lasts one full rest cycle.	consumable		1	99	false	true	false	true	1	1		
item_consumable_afterlife_ward	Afterlife Ward	Single-use resonant seal disrupting Afterlife entity contact. Protects bearer and one adjacent ally from possession for one encounter.	consumable		1	99	false	true	false	true	1	1		
item_consumable_poison_compound	Poison Compound	Concentrated toxin. Applies Stagger 2 and Vulnerable 2 for 2 turns. Illegal in most Ironhold-controlled areas.	consumable		1	99	false	true	false	true	1	1		
item_consumable_smoke_signal_charge	Smoke Signal Charge	Thrown device releasing resonance-disrupting smoke. Blocks signal weapon line-of-sight and disrupts Wire Craft targeting in 20 feet for 2 turns.	consumable		1	99	false	true	false	true	1	1		
item_consumable_resonant_overclock_patch	Resonant Overclock Patch	Adhesive resonant patch overclocking enhancement performance. Grants +1 AP Max for one encounter. Stress check required afterward.	consumable		1	99	false	true	false	true	1	1		
item_consumable_bone_set_compound	Bone Set Compound	Medical-grade field trauma compound. Removes one Stagger or Vulnerable stack and restores 4 HP.	consumable		1	99	false	true	false	true	1	1		
item_consumable_signal_nullifier	Signal Nullifier	Nullifies all Wire Craft signals in a 30-foot radius for 1 turn. Prevents signal-dependent cards. Affects allies too.	consumable		1	99	false	true	false	true	1	1		
item_weapon_bone_blade	Bone-Blade	A weapon partially constructed from Iron Afterlife material. Ignores Guard against undead and Afterlife entities.	weapon		1	1	false	true	true	false	1	2		
item_weapon_wire_gauntlet	Wire Gauntlet	Wired fist weapon for unarmed combat enhancement. Applies Bleed 1 on each hit.	weapon		1	1	false	true	true	false	1	1		
item_weapon_resonant_crossbow	Resonant Crossbow	Standard crossbow with resonant rail modification. Silent fire; does not trigger Wire Craft signal alerts on discharge.	weapon		1	1	false	true	true	false	2	2		
item_weapon_dissolution_lance	Dissolution Lance	Oni Hunter-crafted spear channeling dissolution resonance. Applies Expose 2 on hit against shell-state targets.	weapon		1	1	false	true	true	false	1	3		
item_weapon_grief_blade	Grief Blade	A blade forged from condensed grief-resonance. Deals bonus damage equal to Echo Speaker grief stacks when relevant.	weapon		1	1	false	true	true	false	1	2		
item_weapon_ashlands_warclub	Ashlands Warclub	Heavy impact weapon from salvaged industrial material. Deals +2 damage on first hit per encounter.	weapon		1	1	false	true	true	false	1	2		
item_armor_between_walkers_coat	Between-Walker's Coat	Long coat of resonant thread woven with Between-space material. Light armor; grants resistance to incorporeal damage and reduces Phantom Charge cost by 1.	armor		1	1	false	true	true	false	2	3		
item_armor_wire_market_concealment_suit	Wire Market Concealment Suit	Civilian wire-mesh suit suppressing enhancement signatures. Light armor; advantage on disguise and surveillance-avoidance checks.	armor		1	1	false	true	true	false	2	2		
item_armor_ashlands_hardened_vest	Ashlands Hardened Vest	Salvage-material vest with contamination-resistant lining. Medium armor; reduces Engine Scar contamination accumulation by one step.	armor		1	1	false	true	true	false	2	2		
item_material_resonant_core	Resonant Core	Concentrated resonant metal core used in enhancement upgrades and weapon refinement. Required for Tier 2 and above crafting.	gear		1	1	false	true	false	false	1	1		
item_material_wire_silk_spool	Wire-Silk Spool	Raw wire-silk for armor repair, augmentation construction, and field modifications. Consumed in craft procedures.	gear		1	99	false	true	false	false	1	1		
item_material_void_essence	Void Essence	Distilled void energy in crystalline form. Required for Fracture Knight and Void Walker upgrade procedures.	gear		1	1	false	true	false	false	1	1		
item_material_ashlands_salvage	Ashlands Salvage Components	Mixed salvage from Ashlands operations. Raw material for Ashfoot and Ronin field modifications. Three units per procedure.	gear		1	99	false	true	false	false	1	1		
item_material_biological_compound	Raw Biological Compound	Unprocessed biological material for Flesh Shaper procedures. Must be used within 48 hours.	gear		1	1	false	true	false	false	1	1		
item_currency_ironhold_chit	Ironhold Labor Chit	Ironhold-issued labor voucher redeemable for caste-level services within Ironhold zones. Often traded illegally.	currency		1	99	false	true	false	false	1	1		
item_currency_wire_market_credit	Wire Market Credit Token	Registered Wire Market credit token. Worth 25 trade-metal in Wire Market exchanges; worthless outside Pale Reach without authorization.	currency		1	99	false	true	false	false	1	1		
item_currency_resonant_scrip	Resonant Scrip	Unofficial high-value exchange medium used in black-market enhancement transactions. Untraceable.	currency		1	99	false	true	false	false	1	1		
item_weapon_resonant_blade_tier2	Resonant Blade (Refined)	Professionally refined resonant blade with improved frequency alignment. Deals +1 damage and applies Expose 1 on critical hits.	weapon		1	1	false	true	true	false	1	2		
item_weapon_resonant_blade_tier3	Resonant Blade (Masterwork)	Master-crafted resonant blade at peak material performance. Deals +2 damage, applies Expose 2, and ignores 2 Guard.	weapon		1	1	false	true	true	false	1	2		
item_weapon_resonant_greatsword_refined	Resonant Greatsword (Refined)	Professionally refined two-handed resonant blade. Deals +1 damage and knocks back on heavy strikes.	weapon		1	1	false	true	true	false	2	3		
item_weapon_ironclad_oath_blade	Oath-Blade	A resonant blade formally bound to an Ironclad Samurai through the Vein Oath ritual. Deals bonus damage equal to Vein Oath discipline tier. Returns to bearer if disarmed.	weapon		1	1	false	true	true	false	1	2		
item_weapon_sutensai_reading_blade	Reading Blade	A blade maintained in ritual purity by a Sutensai. Deals standard damage; on hit, triggers a shallow Echomind impression reading of the target.	weapon		1	1	false	true	true	false	1	2		
item_weapon_blood_smith_enhancement_blade	Enhancement Blade	A blade with resonant-biological enhancement integration. Deals damage equal to Blood Smith HP tier bonus. Costs 2 HP to activate enhancement on strike.	weapon		1	1	false	true	true	false	1	2		
item_weapon_void_walker_phase_blade	Phase Blade	A blade partially phased into the Between. Bypasses Shield and reduces Guard by 3. Requires Void Walker class or Between attunement.	weapon		1	1	false	true	true	false	1	2		
item_weapon_echo_speaker_grief_lance	Grief Lance	A polearm resonating with accumulated grief-energy. Deals bonus damage equal to current grief stacks. Applies Mark 2 on hit.	weapon		1	1	false	true	true	false	1	3		
item_weapon_fracture_knight_fracture_spear	Fracture Spear	A spear loaded with fracture-resonance. Generates 1 Phantom Charge on each hit. Applies Fracture stacks to target.	weapon		1	1	false	true	true	false	1	3		
item_weapon_shell_dancer_counter_blade	Counter Blade	A blade balanced for reactive combat. Generates 2 Cascade on being struck while equipped.	weapon		1	1	false	true	true	false	1	2		
item_weapon_iron_monk_between_fist	Between-Fist Wrapping	Resonant wrappings for unarmed combat channeling Between-space energy. Unarmed strikes deal +RESONANCE damage while Between State is active.	weapon		1	1	false	true	true	false	1	1		
item_weapon_merchant_knife_ledger_blade	Ledger Blade	A short blade etched with intelligence notation marks. On kill, automatically gathers 1 intelligence stack on the next nearest enemy.	weapon		1	1	false	true	true	false	1	1		
item_weapon_shadow_daimyo_invisible_blade	Invisible Blade	A blade treated with signal-null compound. Cannot be detected by Wire Craft scanning. First strike each encounter is unblockable.	weapon		1	1	false	true	true	false	1	2		
item_weapon_curse_eater_loaded_hammer	Loaded Hammer	A heavy weapon constructed from absorbed curse material. Deals damage multiplied by current Loaded Count. Resets Loaded Count to 0 after use.	weapon		1	1	false	true	true	false	2	2		
item_weapon_flesh_shaper_bio_blade	Bio-Blade	A blade grown from Flesh Shaper biological material. Regenerates 1 HP per hit. Scales with current HP Tier.	weapon		1	1	false	true	true	false	1	2		
item_weapon_puppet_binder_thread_lance	Thread Lance	A polearm trailing binding threads. On hit, applies one binding thread to target without using a card action.	weapon		1	1	false	true	true	false	1	3		
item_weapon_iron_herald_command_blade	Command Blade	A blade engraved with Command Zone markers. While Command Zone is active, blade deals +2 damage and applies Taunt 1 on hit.	weapon		1	1	false	true	true	false	1	2		
item_weapon_voice_of_debt_debt_blade	Debt Blade	A blade etched with debt notation marks. On kill, automatically transfers all Debt stacks from target to nearest living enemy.	weapon		1	1	false	true	true	false	1	2		
item_weapon_wireweave_signal_whip	Signal Whip	A wire-silk whip integrated with signal-discharge nodes. Applies Silence 1 on hit. Reach weapon; pulls target 5 feet on successful grapple.	weapon		1	1	false	true	true	false	2	1		
item_weapon_ronin_masterless_blade	Masterless Blade	A blade bearing no oath marks. Deals bonus damage equal to days without a contract. Loses bonus when contract is active.	weapon		1	1	false	true	true	false	1	2		
item_weapon_ashfoot_salvage_machete	Salvage Machete	A heavy blade assembled from enhancement scrap. Deals extra damage against enhanced targets. Degrades after three encounters without maintenance.	weapon		1	1	false	true	true	false	1	2		
item_weapon_oni_hunter_dissolution_blade	Dissolution Blade	A blade charged with dissolution resonance. Deals double damage to targets in shell-state. Applies Vulnerable 2 on hit against dissolution-touched targets.	weapon		1	1	false	true	true	false	1	2		
item_weapon_veilblade_wire_sword	Wire-Sword	A blade threaded through with active wire-silk. On hit, deploys a temporary wire trap dealing Bleed 2 to anyone moving through the space.	weapon		1	1	false	true	true	false	1	2		
item_weapon_forge_tender_repair_hammer	Repair Hammer	A tool and weapon in one. On non-combat use, repairs 4 HP to an adjacent Forged or enhanced ally. In combat, deals standard impact damage.	weapon		1	1	false	true	true	false	1	2		
item_weapon_hollow_void_blade	Void-Blade	A blade that absorbs incoming resonance. When below 25% HP, deals triple damage. Applies Expose 3 while bearer is at critical HP Percent.	weapon		1	1	false	true	true	false	1	2		
item_weapon_chrome_shaper_modular_arm	Modular Weapon Arm	A Chrome Shaper limb-integrated weapon system. Deals damage appropriate to current configuration. Swaps damage type with configuration switch.	weapon		1	1	false	true	true	false	2	2		
item_weapon_pulse_caller_integrated_lance	Integrated Lance	A melee weapon integrated with pulse-arm discharge. Can fire as ranged (AP 1) or strike as melee (free). Combines both damage types.	weapon		1	1	false	true	true	false	2	2		
item_weapon_sutensai_ritual_staff	Ritual Staff	A staff used in Iron Sutra ceremonies. Deals RESONANCE damage. On kill, allows a shallow Echomind reading of the dying target's final impression.	weapon		1	1	false	true	true	false	1	3		
item_armor_resonant_plate_tier2	Resonant Plate (Reinforced)	Reinforced resonant plate with additional resonant layering. Provides +2 Guard passively. Professional military grade.	armor		1	1	false	true	true	false	2	3		
item_armor_resonant_plate_tier3	Resonant Plate (Warded)	Warded resonant plate at peak defensive construction. Provides +3 Guard passively and negates first Stagger each encounter.	armor		1	1	false	true	true	false	2	3		
item_armor_forged_chassis_plate	Forged Chassis Plate	Armor plating designed to integrate with Forged chassis systems. Counts as maintenance-compatible; does not increase maintenance difficulty.	armor		1	1	false	true	true	false	2	3		
item_armor_iron_monk_wrappings	Iron Monk Combat Wrappings	Full-body resonant wrappings for Iron Monk practice. Light armor. While Between State is active, provides additional Guard 3.	armor		1	1	false	true	true	false	2	2		
item_armor_veilblade_wire_coat	Wire-Coat	A long coat reinforced with active wire-silk. Light armor. Provides signal disruption; Wire Craft targeting rolls against bearer have disadvantage.	armor		1	1	false	true	true	false	2	3		
item_armor_puppet_binder_thread_robe	Thread Robe	A robe threaded with active binding material. Light armor. Each binding thread active on enemies also provides Guard 1 to bearer (max Guard 5 from this source).	armor		1	1	false	true	true	false	2	2		
item_armor_sutensai_ceremonial_plate	Sutensai Ceremonial Plate	Formal resonant plate worn by Sutensai during readings and rites. Medium armor. Provides social authority equal to a full Keeper rank when worn visibly.	armor		1	1	false	true	true	false	2	3		
item_armor_flesh_shaper_bio_carapace	Bio-Carapace	Biological armor grown by a Flesh Shaper. Heavy armor. Regenerates 1 Guard per turn. Requires Bio-Reinforcement Compound to maintain.	armor		1	1	false	true	true	false	2	3		
item_armor_shadow_daimyo_concealment_suit	Shadow Concealment Suit	Full-body concealment suit for Shadow Daimyo operations. Light armor. Invisible to standard Wire Craft scanning. First round of combat, bearer cannot be targeted.	armor		1	1	false	true	true	false	2	2		
item_armor_voice_of_debt_debt_marked_robe	Debt-Marked Robe	A robe bearing visible Debt notation marks. Light armor. Enemies with active Debt stacks deal -2 damage to bearer.	armor		1	1	false	true	true	false	2	2		
item_armor_echo_speaker_grief_cloak	Grief Cloak	A cloak woven with grief-resonant material. Light armor. Grants immunity to Taunt. Converts incoming emotional manipulation effects to Regen 1.	armor		1	1	false	true	true	false	2	2		
item_armor_fracture_knight_phantom_plate	Phantom Plate	Armor partially phased into Between-space. Medium armor. Each Phantom Charge spent while wearing provides Guard 2 until next turn.	armor		1	1	false	true	true	false	2	3		
