faction	leader	territory	primary_goal	conflict_with	notes
Korrath	Korrath the Unbroken	Sunder Reach	Ascend as God-Claimant; remake Tesshari under iron law	Iron Sutra, Vaen	Largest military force; uses Ironblood caste as instrument
Vaen	Vaen of the Empty Hand	Veilward Reach	Complete the Pilgrimage; reach the Gap through surrender of self	Korrath, Iron Sutra	Hollow Author-favored; most enigmatic claimant; minimal army
Hollow Author	Unknown	No fixed territory (network)	Infiltrate all factions; control the outcome of Convergence	All claimants	True identity unknown; operates through proxies; may be multiple entities
Iron Sutra	High Inquisitor (unnamed)	Pale Reach (partial)	Maintain orthodoxy; prevent unregistered ascension	Korrath, Hollow Author	Sutensai institutional arm; controls legal enhancement access
Wire Market	Guild Master Harren	Pale Reach (commercial)	Profit from Convergence; sell to all sides	None permanently	Neutral mercantile power; will shift allegiance for advantage
Pilgrimage	Vaen (symbolic)	Veilward Reach / mobile	Follow Vaen to the Gap; survive Convergence as witnesses	Korrath military	Loose coalition; many Shellbroken and Echoed followers
Sutensai Order	Chars Voice (presumed)	Iron Teeth Reach (temple)	Preserve the Sutensai revelation; choose correct Claimant	Hollow Author	Theocratic faction; controls resonance orthodoxy certification