location_id	name	region	key_threat	key_opportunity	encounter_theme
cinderfort	Cinderfort	Sunder Reach	Korrath military garrison; active conscription zone	Intel on Korrath troop movements; potential Ironblood defector	Military tension, oath-under-pressure, survival
deep_temple	Deep Temple	Iron Teeth Reach (underground)	Iron Sutra warden squads; sealed chamber unknown contents	Sutensai archive access; Chars Voice communication channel	Theological revelation, forbidden knowledge, resonance testing
preparation_halls	Preparation Halls	Pale Reach	Iron Sutra inspection presence; Hollow Author agent embedded	Restricted Sutensai historical records; black market access via the Collector	Information acquisition, faction maneuvering, moral ambiguity
engine_scar	Engine Scar	Sunder Reach	Unstable resonance field; prior-cycle remnant guardians	Prior-cycle technology; potential Fracture reversal components	Environmental hazard, prior-cycle mystery, power at cost
shore_of_last_words	Shore of Last Words	Veilward Reach	Dissolution pull toward the Gap; compulsion effects	Vaen's trail; Drowned Archivist knowledge repository	Existential encounters, identity, the cost of ascension
ruined_citadel	Ruined Citadel	Veilward Reach	Prior-cycle guardian bound to defend; Hollow Author observation post	Prior-cycle archival fragments; oath-bond relic possibly stored here	Ruin exploration, prior oath mechanics, claimant intelligence